{
  "$schema": "https://json-schema.org/draft/2020-12/schema",
  "$id": "https://agent-teams.ai/schemas/foundation-transaction-envelope/v2",
  "title": "Foundation Transaction Envelope",
  "type": "object",
  "additionalProperties": false,
  "required": ["schemaVersion", "operationKind", "recoveryHandler", "foundation", "adapterContractVersion", "payloadKind", "journal", "payloadDigest", "state", "envelopeDigest"],
  "properties": {
    "schemaVersion": { "const": 2 },
    "operationKind": { "enum": ["document-authoring", "scaffolding"] },
    "recoveryHandler": {
      "type": "object",
      "additionalProperties": false,
      "required": ["id", "contractVersion"],
      "properties": {
        "id": { "enum": ["foundation.document-authoring", "foundation.scaffolding"] },
        "contractVersion": { "const": 1 }
      }
    },
    "foundation": {
      "type": "object",
      "additionalProperties": false,
      "required": ["version", "buildIdentity"],
      "properties": {
        "version": { "$ref": "#/$defs/semver" },
        "buildIdentity": { "$ref": "#/$defs/digest" }
      }
    },
    "adapterContractVersion": { "const": 1 },
    "payloadKind": { "enum": ["document-authoring-journal/v1", "scaffold-recovery-journal/v1"] },
    "journal": {},
    "payloadDigest": { "$ref": "#/$defs/digest" },
    "state": { "enum": ["PREPARED", "PUBLISHING", "PUBLISHED"] },
    "envelopeDigest": { "$ref": "#/$defs/digest" }
  },
  "allOf": [
    { "$ref": "#/$defs/documentAuthoringEnvelope" },
    { "$ref": "#/$defs/scaffoldingEnvelope" }
  ],
  "$defs": {
    "digest": { "type": "string", "pattern": "^sha256:[0-9a-f]{64}$" },
    "semver": { "type": "string", "pattern": "^(0|[1-9]\\d*)\\.(0|[1-9]\\d*)\\.(0|[1-9]\\d*)(?:-((?:0|[1-9]\\d*|\\d*[A-Za-z-][0-9A-Za-z-]*)(?:\\.(?:0|[1-9]\\d*|\\d*[A-Za-z-][0-9A-Za-z-]*))*))?(?:\\+[0-9A-Za-z-]+(?:\\.[0-9A-Za-z-]+)*)?$" },
    "repositoryPath": {
      "type": "string",
      "minLength": 1,
      "maxLength": 512,
      "pattern": "^(?!.*(?:^|/)\\.{1,2}(?:/|$))(?!.*\\.(?:/|$))(?!.*(?:^|/)(?:[Cc][Oo][Nn]|[Pp][Rr][Nn]|[Aa][Uu][Xx]|[Nn][Uu][Ll]|[Cc][Oo][Mm][1-9]|[Ll][Pp][Tt][1-9])(?:\\.[A-Za-z0-9._@-]*)?(?:/|$))[A-Za-z0-9._@-]{1,255}(?:/[A-Za-z0-9._@-]{1,255})*$"
    },
    "documentJournal": {
      "type": "object",
      "additionalProperties": false,
      "required": ["schemaVersion", "plan", "destination"],
      "properties": {
        "schemaVersion": { "const": 1 },
        "plan": { "$ref": "https://agent-teams.ai/schemas/document-plan/v1" },
        "destination": {
          "type": "object",
          "additionalProperties": false,
          "required": ["path", "state"],
          "properties": {
            "path": { "$ref": "#/$defs/repositoryPath" },
            "state": { "enum": ["pending", "preexisting", "publishing", "published"] }
          }
        },
        "ownedTemporary": {
          "type": "object",
          "additionalProperties": false,
          "required": ["path", "digest", "identity"],
          "properties": {
            "path": { "$ref": "#/$defs/repositoryPath" },
            "digest": { "$ref": "#/$defs/digest" },
            "identity": { "$ref": "#/$defs/nodeTemporaryIdentity" }
          }
        }
      }
    },
    "nodeTemporaryIdentity": {
      "type": "object",
      "additionalProperties": false,
      "required": ["adapter", "version", "dev", "ino", "birthtimeNs"],
      "properties": {
        "adapter": { "const": "node-filesystem" },
        "version": { "const": 1 },
        "dev": { "$ref": "#/$defs/unsignedDecimal" },
        "ino": { "$ref": "#/$defs/unsignedDecimal" },
        "birthtimeNs": { "$ref": "#/$defs/unsignedDecimal" }
      }
    },
    "unsignedDecimal": {
      "type": "string",
      "pattern": "^(?:0|[1-9][0-9]*)$",
      "maxLength": 32
    },
    "documentAuthoringEnvelope": {
      "if": { "type": "object", "properties": { "operationKind": { "const": "document-authoring" } }, "required": ["operationKind"] },
      "then": {
        "type": "object",
        "properties": {
          "recoveryHandler": {
            "type": "object",
            "properties": { "id": { "const": "foundation.document-authoring" } }
          },
          "payloadKind": { "const": "document-authoring-journal/v1" },
          "journal": { "$ref": "#/$defs/documentJournal" }
        }
      }
    },
    "scaffoldingEnvelope": {
      "if": { "type": "object", "properties": { "operationKind": { "const": "scaffolding" } }, "required": ["operationKind"] },
      "then": {
        "type": "object",
        "properties": {
          "recoveryHandler": {
            "type": "object",
            "properties": { "id": { "const": "foundation.scaffolding" } }
          },
          "payloadKind": { "const": "scaffold-recovery-journal/v1" },
          "journal": { "$ref": "https://agent-teams.ai/schemas/scaffold-recovery-journal/v1" },
          "state": { "const": "PREPARED" }
        }
      }
    }
  }
}
